{
  "runId": "20260614193127",
  "decisionId": "destructive-command",
  "stageId": "destructive-command",
  "actionType": "command",
  "resource": "rm -rf build",
  "reason": "Destructive shell commands require explicit policy handling.",
  "policyRuleId": "commands.destructive",
  "requestedApprovalActor": "human",
  "command": "rm -rf build"
}
